{
  "contract_family": "agent-memory-same-harness-lane",
  "contract_version": "1.0.0",
  "lane_id": "longmemeval-s-retrieval-parity-v3",
  "status": "accepted",
  "owning_issue": 669,
  "frozen_on": "2026-10-07",
  "frozen_before_any_score": true,
  "description": "Fourth lane generation (#669): frozen LongMemEval_S retrieval parity, retrieval only, no LLM anywhere, re-executing every row of longmemeval-s-retrieval-parity-v2 at a runtime revision in the declared transition to Runtime Baseline v3 (ranking policy 3.2.0; semantic vector route reachable, default off). The Agent Memory control runs the shipped default (semantic route off, budget 50) and must reproduce every scored metric of the -v2 control exactly; this lane is acceptance evidence reports/runtime/baseline-v3-declaration.json names for the successor publication. A measured comparator row (agent_memory_semantic) runs the same facade with semantic_retrieval=required under the pinned local representation; it is evidence for #673, not the publication control. Hindsight stays deferred.",
  "freeze_rationale": [
    "the -v2 lane is accepted and its control executed the declared transition to Runtime Baseline v2; the #669 tranche (PR #707) changed ranking policy to 3.2.0 (semantic_vector as an ordering-subordinate route) and opened a declared transition to v3, so the executing runtime is new and needs a new lane id (change_rule)",
    "the control declares no semantic_retrieval (the runner and importer read absence as off, the shipped default); every scored metric must equal the accepted -v2 control's exactly (headline, knowledge_update_headline and latest_gold_ranked_first on both planes; timing and governance counters excluded); any difference blocks v3 publication",
    "the agent_memory_semantic row is pre-registered before any score: turn recall_all@50 and session recall_all@5/@10 equal the control's or differ only by tie reordering; session recall_all@30/@50 may rise because semantic-only candidates can reach ranks 34-50 on the session plane; 'move' means a strict increase on the same 419 scored questions",
    "#669's original gate (turn recall_all@50 and session recall_all@5 must move) is structurally unattainable under policy 3.2.0: a semantic-only candidate ranks after every lexical candidate, and the -v2 control admits at least 113 lexical candidates per turn question and at least 33 per session question; the gate transfers to #673 (fusion) with this row's route diagnostics",
    "the baseline and comparator rows are re-executed unchanged so every row shares one runner blob and one executing posture; accepted -v2 rows are never copied forward"
  ],
  "benchmark_integration": "agent-memory-longmemeval-retrieval-currentness-v1",
  "harness": {
    "repository": "xiaowu0162/LongMemEval",
    "url": "https://github.com/xiaowu0162/LongMemEval",
    "revision": "9e0b455f4ef0e2ab8f2e582289761153549043fc",
    "package": "reference/run_longmemeval.py (repository-owned replica of the upstream retrieval evaluator at the pinned revision; retrieval only, the upstream model-judged QA evaluator is never run). source_blobs bind the upstream files the replica reproduces (src/retrieval/*) and the repository files that execute the lane (reference/*); the workflow refuses to run if a reference/* blob differs.",
    "license_spdx": "MIT",
    "license_note": "upstream code MIT (LICENSE blob below); the cleaned dataset is obtained by the operator from the Hugging Face hub at the recorded revision and is never redistributed by this repository",
    "entry": "PYTHONPATH=reference python reference/run_longmemeval.py --input longmemeval_s_cleaned.json --corpus-class external_frozen --granularity <session|turn> --backend <agent_memory|lexical_overlap|mem0_explicit> [--external-backend longmemeval_mem0_explicit_bridge:install_longmemeval_mem0_explicit_backend]",
    "source_blobs": {
      "src/retrieval/run_retrieval.py": "48e615df943a329801c3703edf4f83dc0a18fe17",
      "src/retrieval/eval_utils.py": "9c43a835e7c41aff0eb3272c448f5cbe76bbbd45",
      "LICENSE": "2e2c8491038bf0383c324a478b66a4663833efea",
      "reference/run_longmemeval.py": "eaa7ca96bc68cec23eab904ca9fed76db82faafc",
      "reference/longmemeval_mem0_explicit_bridge.py": "08366b72ac0d76fdc0754a8182e3b6fd61cb1912",
      "reference/amb_mem0_explicit_bridge.py": "ce41b1f5766b99cb968b798be3ad6d37c3283228"
    }
  },
  "dataset": {
    "harness_dataset": "longmemeval-cleaned",
    "split": "LongMemEval_S (longmemeval_s_cleaned.json)",
    "upstream": {
      "repository": "xiaowu0162/LongMemEval",
      "revision": "9e0b455f4ef0e2ab8f2e582289761153549043fc",
      "license_spdx": "MIT",
      "paper_url": "https://arxiv.org/abs/2410.10813"
    },
    "fixtures": [
      {
        "name": "longmemeval_s_cleaned.json",
        "url": "https://huggingface.co/datasets/xiaowu0162/longmemeval-cleaned/resolve/98d7416c24c778c2fee6e6f3006e7a073259d48f/longmemeval_s_cleaned.json?download=true",
        "sha256": "d6f21ea9d60a0d56f34a05b609c79c88a451d2ae03597821ea3d5a9678c3a442"
      }
    ],
    "input_sha256": "d6f21ea9d60a0d56f34a05b609c79c88a451d2ae03597821ea3d5a9678c3a442",
    "input_digest_rule": "sha256 over the raw bytes of longmemeval_s_cleaned.json (277,383,467 bytes at hub revision 98d7416c); the runner streams and hashes every byte on each pass and refuses if any pass disagrees; the workflow also checks the download against this digest before the run",
    "document_count": 23867,
    "query_count": 500,
    "query_partition": {
      "single-session-user": 70,
      "single-session-assistant": 56,
      "single-session-preference": 30,
      "multi-session": 133,
      "temporal-reasoning": 133,
      "knowledge-update": 78
    },
    "notes": [
      "document_count is the session plane: 23,867 haystack sessions summed over the 500 questions (max 62 per question); the turn plane indexes 122,416 user turns (max 305 per question). Each question is its own isolated corpus exactly as upstream process_item_flat_index builds a flat index per question; there is no shared corpus across questions.",
      "query_partition is by upstream question_type. Scoring denominators exclude the 30 abstention questions (_abs in question_id) and the 51 questions with no user-side has_answer target, leaving 419 scored questions in both planes; the exclusions are upstream rules replicated byte for byte.",
      "13 questions repeat a haystack session id; the replica indexes each repetition as its own corpus item under the same id, as upstream does, and refuses repeats whose content differs.",
      "the hub serves the fixture with x-linked-etag equal to its sha256, so the digest check is also a check that the hub object is unchanged"
    ]
  },
  "selection": {
    "query_limit": null,
    "category": null,
    "selection_id": "all-500:7d738ae585fd4014",
    "selection_method": "all 500 questions in source order; no --max-questions, no --subset-size; input.selection.question_ids_sha256 must equal 7d738ae585fd4014c9d231088ff824864fded501adc07b0e08c2b97a28210c03"
  },
  "budget": {
    "retrieval_k_rule": "every backend returns one ranking per question; rankings are scored at k in {1, 3, 5, 10, 30, 50} and the top 50 is reported. The lexical baseline returns every overlapping item; the Agent Memory control declares budget=50 on every recall (contract 1.4.0) and ranks the facade's `returned` prefix of its admitted facts, the deepest scored k, so bounding there cannot change any scored metric; the Mem0 row returns top_k=50. No answer-generation context budget exists.",
    "default_k": 50,
    "context_budget": {
      "scored_k": [
        1,
        3,
        5,
        10,
        30,
        50
      ],
      "reported_rank_depth": 50,
      "headline_session": [
        "recall_all@5",
        "ndcg_any@5",
        "recall_all@10",
        "ndcg_any@10"
      ],
      "headline_turn": [
        "recall_all@5",
        "ndcg_any@5",
        "recall_all@10",
        "ndcg_any@10",
        "recall_all@50",
        "ndcg_any@50"
      ],
      "answer_generation": "none"
    },
    "forbidden_overrides": [
      "--max-questions and --subset-size must be unset (subset_size 0 in the workflow); a bounded run is a smoke, never an acceptable row",
      "--agent-memory-temporal-metadata must remain none and --agent-memory-ranking-variant must remain default (the frozen comparability posture: only question and item text reach Agent Memory)",
      "no backend may read answer, answer_session_ids, has_answer, question_type, question_date or haystack_dates of a question; backends receive the question text and the corpus items {id, text, date} only",
      "the Mem0 row may not use infer=True, a graph store, a reranker, the fastembed extra or the spaCy extra; mem0.__version__ must equal 2.2.1",
      "--agent-memory-semantic-retrieval only on agent_memory_semantic (required); every other row runs it off; auto is refused by the runner"
    ]
  },
  "gold_identity": {
    "rule": "per question, exactly upstream: session plane gold = haystack session ids containing 'answer' (relabelled noans when no user turn in that session carries has_answer); turn plane gold = user turns of those sessions with has_answer (others relabelled noans); recall_all/recall_any/ndcg_any computed by the replica of eval_utils.py; turn rankings are also collapsed to distinct sessions for the turn-to-session view",
    "resolution_paths": [
      "item id returned verbatim by the backend (lexical_overlap, no_memory)",
      "admitted fact uuid mapped to the item id through a per-question sidecar that never enters memory text (agent_memory)",
      "metadata.doc_id read back from each Mem0 search result; results without doc_id are counted as unmapped and dropped (mem0_explicit)"
    ],